device,value,footprint,quantity,refdes,digikey PN
74595,unknown,SO16,6,U1 U2 U3 U4 U5 U6,296-14857-1-ND
CAPACITOR,0.1uF,0805,6,C1 C2 C3 C4 C5 C6,311-3562-1-ND
CONNECTOR_2,unknown,SIP2,2,CONN14 CONN15,732-5315-ND
CONNECTOR_4,unknown,SIP4,1,CONN1,732-5317-ND
CONNECTOR_5,unknown,SIP5,12,CONN2 CONN3 CONN4 CONN5 CONN6 CONN7 CONN8 CONN9 CONN10 CONN11 CONN12 CONN13,732-5318-ND
HOLE,unknown,hole_3mm,4,H1 H2 H3 H4,
NPN_TRANSISTOR,unknown,SOT23,45,Q1 Q2 Q3 Q4 Q5 Q6 Q7 Q8 Q9 Q10 Q11 Q12 Q13 Q14 Q15 Q16 Q17 Q18 Q19 Q20 Q21 Q22 Q23 Q24 Q25 Q26 Q27 Q28 Q29 Q30 Q31 Q32 Q33 Q34 Q35 Q36 Q37 Q38 Q39 Q40 Q41 Q42 Q43 Q44 Q45,MMBTA42FSCT-ND
RESISTOR,47,0805,10,R1 R2 R3 R4 R5 R6 R7 R8 R9 R10,311-47.0CRCT-ND
RESISTOR_ARRAY,744C083470JP,CTS_744C_08,9,U7 U8 U9 U10 U11 U12 U13 U14 U15,744C083470JPCT-ND